id	user_id	check_in	check_out	store_id	checkin_type	is_first_checkin	created_at	updated_at	so_id	checkout_type	store_type	store_name	store_address	map_in_lat	map_in_long	map_out_lat	map_out_long	check_in_date	check_in_status	check_in_address	check_out_address
941	21	2018-07-04 13:05:06	2018-07-04 13:06:23	288	1	NULL	NULL	NULL	1	1	2	Vijay Sales Station Rd	Sadhuvas wani chowk	18.52697	18.52697	18.526867	18.526867	2018-07-04	1	PMT Building, Connaught Rd, Agarkar Nagar, Pune, Maharashtra 411001, India	PMT Building, Connaught Rd, Agarkar Nagar, Pune, Maharashtra 411001, India
942	2063	2018-07-04 13:05:14	NULL	27438	2	NULL	NULL	NULL	1	0	1	RD GAURAV TOWER JAIPUR	304,305 GAURAV TOWER,J L N MARG, JAIPUR	26.855106	26.855106	0	0	2018-07-04	1	51, Anurag Path, D-Block, Sector 4, Malviya Nagar, Jaipur, Rajasthan 302017, India	NA
943	2279	2018-07-04 13:06:53	2018-07-04 13:41:33	289	1	NULL	NULL	NULL	1	1	2	Mobile Mart	Old gt road KARNAL	29.689924	29.689924	29.689924	29.689924	2018-07-04	1	GT Rd, Shakti Colony, Karnal, Haryana 132001, India	GT Rd, Shakti Colony, Karnal, Haryana 132001, India
944	2283	2018-07-04 13:07:07	NULL	42233	1	NULL	NULL	NULL	1	0	1	CHUGH ELECTRONICS	7/6 RAM NAGAR KARNAL 1432001	29.697042	29.697042	0	0	2018-07-04	1	33/1, Ram Nagar, Karnal, Haryana 132001, India	NA
945	1878	2018-07-04 13:07:35	NULL	31184	1	NULL	NULL	NULL	1	0	1	HIM TELECOM	B-16 ACHARYA NIKAM MAYUR VIHAR DELHI 110091	28.607407	28.607407	0	0	2018-07-04	1	20/12, Block B, Acharya Niketan, Mayur Vihar Phase 1, New Delhi, Delhi 110091, India	NA
946	2188	2018-07-04 13:07:47	2018-07-04 13:18:44	30438	1	NULL	NULL	NULL	1	4	1	PARVATI ELECTRONICS GOMTI NAGAR LUCKNOW	4/293 VIVEK KHAND,GOMTI NAGAR LUCKNOW	26.853456	26.853456	26.853455	26.853455	2018-07-04	1	4/293, Patrakarpuram Rd, Vivek Khand 4, Gomti Nagar, Lucknow, Uttar Pradesh 226010, India	4/293, Patrakarpuram Rd, Vivek Khand 4, Gomti Nagar, Lucknow, Uttar Pradesh 226010, India
947	2120	2018-07-04 13:07:59	2018-07-04 15:09:26	290	1	NULL	NULL	NULL	1	1	2	Bharat Vyavsaya pvt ltd Agra	Sanjay place Agra	27.200817	27.200817	27.200788	27.200788	2018-07-04	1	Gopaldas Bhawan, Wazirpura Rd, Sanjay Palace, Sanjay Place, Civil Lines, Agra, Uttar Pradesh 282002, India	Gopaldas Bhawan, Wazirpura Rd, Sanjay Palace, Sanjay Place, Civil Lines, Agra, Uttar Pradesh 282002, India
948	1603	2018-07-04 13:09:28	2018-07-04 14:43:45	291	1	NULL	NULL	NULL	1	2	2	royal traders	d1/b/11a janakpuri new delhi-110058	28.607664	28.607664	28.60804	28.60804	2018-07-04	1	D2/32, Block D2, Janakpuri, New Delhi, Delhi 110058, India	25, RZ Block Rd, Block T, Gandhi Market, Sagar Pur, Delhi, 110045, India
949	1241	2018-07-04 13:09:34	2018-07-04 13:10:26	292	1	NULL	NULL	NULL	1	1	2	REKO ELECTONIC COMPANY	DURGA MARKET, ASANSOL	23.68884	23.68884	23.68884	23.68884	2018-07-04	1	Asansol - Chittaranjan Rd, Munshi Bazar, Asansol, West Bengal 713301, India	Asansol - Chittaranjan Rd, Munshi Bazar, Asansol, West Bengal 713301, India
950	2255	2018-07-04 13:09:34	2018-07-04 13:27:58	27393	1	NULL	NULL	NULL	1	4	1	VERMA ENTERPRISES CHANDIGARH	Mullanpur Distt Mohali	30.79946	30.79946	30.801876	30.801876	2018-07-04	1	Mullanpur Garibdass, Punjab 140901, India, Mullanpur Garibdass	Kurali Chandigarh Rd, Mullanpur Garibdass, Punjab 140901, India
951	2395	2018-07-04 13:09:43	2018-07-04 15:57:52	293	1	NULL	NULL	NULL	1	1	2	Amsa Vision PERAMBUR	Mpm street PERAMBUR	13.11575	13.11575	13.088049	13.088049	2018-07-04	1	95, Melpatti Ponnappan St, Chinnaiyan Colony, Perambur, Chennai, Tamil Nadu 600039, India	Eden Plaza, Perambur Barracks Rd, Choolai, Chennai, Tamil Nadu 600112, India
952	786	2018-07-04 13:10:01	NULL	294	1	NULL	NULL	NULL	1	0	2	Rd Ranip	30/46 Ground Floor/ First Floor  Arved Transcube Plaza Subhash Bridge Bus Terminal Nr. RTO Circle Ahmedabad 382420	23.06823	23.06823	0	0	2018-07-04	1	132 Feet Ring Rd, Bandhu Nagar, Vijay Nagar, Ranip, Ahmedabad, Gujarat 382480, India	NA
953	2098	2018-07-04 13:10:06	NULL	27795	2	NULL	NULL	NULL	1	0	1	MS PATAWARI ENTERPRISES JAIPUR	PLOT NO 4 MAHAVEER NAGAR MAIN TONK ROAD 	26.855616	26.855616	0	0	2018-07-04	1	NH 12, Kailash Puri Colony, Milap Nagar, Jaipur, Rajasthan 302018, India	NA
954	2282	2018-07-04 13:10:54	2018-07-04 13:11:00	38050	1	NULL	NULL	NULL	1	1	1	DODA ELECTRONICS KARNAL	417 ASHOKA COLONY OPP POLICE LINE KARNAL 132001	29.692108	29.692108	29.692108	29.692108	2018-07-04	1	12-A, Kunjpura Rd, Old Char Chaman, Dyal Singh Colony, Karnal, Haryana 132001, India	12-A, Kunjpura Rd, Old Char Chaman, Dyal Singh Colony, Karnal, Haryana 132001, India
955	710	2018-07-04 13:11:05	2018-07-04 13:12:42	37325	1	NULL	NULL	NULL	1	1	1	SOLVY TECH SOLUTIONS PVT LTD MOBILE GHAR SURAT	7B/1278, Shop no 1 Refai baug hodi bangle ved road surat, Gujarat - 395003	21.214432	21.214432	21.214458	21.214458	2018-07-04	1	206, Ved Rd, Fatakdawadi, Industrial Area, Vishal Nagar, Surat, Gujarat 395004, India	206, Ved Rd, Fatakdawadi, Industrial Area, Singanpor, Surat, Gujarat 395004, India
956	2273	2018-07-04 13:11:27	NULL	295	1	NULL	NULL	NULL	1	0	2	Om Sai Traders	Krishna market gharaunda	29.5329	29.5329	0	0	2018-07-04	1	Srinagar - Kanyakumari Hwy, Durga Colony, Gharaunda, Haryana 132114, India	NA
957	710	2018-07-04 13:12:50	NULL	33238	1	NULL	NULL	NULL	1	0	1	ARYA MOBILE GALLERY	20 PANDAL SHOPPING CENTRE VED RD KATARGAM SURAT 395004	21.214464	21.214464	0	0	2018-07-04	1	206, Ved Rd, Fatakdawadi, Industrial Area, Singanpor, Surat, Gujarat 395004, India	NA
958	2080	2018-07-04 13:13:27	NULL	296	2	NULL	NULL	NULL	1	0	2	GREAT EASTERN TRADING CO.	PLOT NO 36A SCHEME NO 03 PARASRAM NAGAR SIKAR ROAD JAIPUR	26.950743	26.950743	0	0	2018-07-04	1	3/29,3/30, Parasram Nagar, Dahar Ka Balaji, Jaipur, Rajasthan 302039, India	NA
959	2209	2018-07-04 13:13:49	2018-07-04 13:13:50	24310	1	NULL	NULL	NULL	1	4	1	SHUBHAM REFRIGERATION LUCKNOW	JUGAULI CROSSING VISHWAS KHAND GOMTI NAGAR LUCKNOW LUCKNOW	26.877838	26.877838	26.877838	26.877838	2018-07-04	1	2, Ishwarpuri Colony, Ishwar Puri, Indira Nagar, Lucknow, Uttar Pradesh 226016, India	2, Ishwarpuri Colony, Ishwar Puri, Indira Nagar, Lucknow, Uttar Pradesh 226016, India
960	2127	2018-07-04 13:13:51	2018-07-04 13:13:58	297	1	NULL	NULL	NULL	1	1	2	Hum Tum Telecom	G-1 Anand vrindawan tower Sanjay place Agra 282002	27.198404	27.198404	27.198404	27.198404	2018-07-04	1	22/5, Bagirati Rd, Emporium Block, Opposite Speed Color Lab, Sanjay Place, Civil Lines, Agra, Uttar Pradesh 282002, India	22/5, Bagirati Rd, Emporium Block, Opposite Speed Color Lab, Sanjay Place, Civil Lines, Agra, Uttar Pradesh 282002, India
961	2520	2018-07-04 13:13:54	2018-07-04 14:33:23	298	1	NULL	NULL	NULL	1	1	2	ANNAMALAI CELL CITY	NO. 298,G N T ROAD,REDHILLS,CHENNAI 600052	13.194756	13.194756	13.192974	13.192974	2018-07-04	1	RRC St, Redhills, Padiyanallur, Tamil Nadu 600052, India	TVK St, Redhills, Padiyanallur, Tamil Nadu 600052, India
962	2587	2018-07-04 13:15:00	2018-07-04 13:20:10	28398	1	NULL	NULL	NULL	1	4	1	AAINA ELECTRONICS LUDHIANA	DOMORIA PULL CIVIL LINES LUDHIANA	30.919619	30.919619	30.919619	30.919619	2018-07-04	1	1255, Domoria Bridge Rd, Civil Lines, Ludhiana, Punjab 141008, India	1255, Domoria Bridge Rd, Civil Lines, Ludhiana, Punjab 141008, India
963	2091	2018-07-04 13:15:14	2018-07-04 13:15:29	28615	1	NULL	NULL	NULL	1	1	1	DHAVIT ENTERPRISES JAIPUR	SHOP NO G-22 MAHIMA TRINITY P NO 5 SWAGE FARM NEW SANGANER JAIPUR	26.8908	26.8908	26.8908	26.8908	2018-07-04	1	A-21, Swage Farm Rd, Sunder Singh Bhandari Nagar, Ganesh Nagar, Govindpuri, Jaipur, Rajasthan 302019, India	A-21, Swage Farm Rd, Sunder Singh Bhandari Nagar, Ganesh Nagar, Govindpuri, Jaipur, Rajasthan 302019, India
964	2209	2018-07-04 13:15:18	2018-07-04 13:15:19	24310	1	NULL	NULL	NULL	1	4	1	SHUBHAM REFRIGERATION LUCKNOW	JUGAULI CROSSING VISHWAS KHAND GOMTI NAGAR LUCKNOW LUCKNOW	26.877844	26.877844	26.877844	26.877844	2018-07-04	1	2, Ishwarpuri Colony, Ishwar Puri, Indira Nagar, Lucknow, Uttar Pradesh 226016, India	2, Ishwarpuri Colony, Ishwar Puri, Indira Nagar, Lucknow, Uttar Pradesh 226016, India
965	2105	2018-07-04 13:15:20	2018-07-04 13:16:08	24036	1	NULL	NULL	NULL	1	1	1	SHRI SHYAM CORPORATION SIRSI ROAD JAIPUR	near 21 bus stand meenawala jaipur	26.923435	26.923435	26.923435	26.923435	2018-07-04	1	A10, Sirsi Rd, Pawan Putra D Colony, Kanakpura, Jaipur, Rajasthan 302034, India	A10, Sirsi Rd, Pawan Putra D Colony, Kanakpura, Jaipur, Rajasthan 302034, India
966	716	2018-07-04 13:15:41	NULL	31979	1	NULL	NULL	NULL	1	0	1	ASOPALAV ENTERPRISE	12 CROSS RD SHOPPIN CENTRE AMROLI SAYAN RD SURAT 395004	21.241655	21.241655	0	0	2018-07-04	1	3, Sayan Rd, Vishwa Nagar Society, Bhagu Nagar-1, Amroli, Surat, Gujarat 394107, India	NA
967	2291	2018-07-04 13:15:40	2018-07-04 13:15:47	30728	1	NULL	NULL	NULL	1	1	1	SUBHASH CHAND ASHOK KUMAR AMBALA	21-22 RAI MARKET AMBALA	30.341293	30.341293	30.341293	30.341293	2018-07-04	1	124, Rai Market Rd, Palledar Mohalla, Ambala Cantt, Haryana 133001, India	124, Rai Market Rd, Palledar Mohalla, Ambala Cantt, Haryana 133001, India
968	2209	2018-07-04 13:15:53	2018-07-04 13:15:53	24310	1	NULL	NULL	NULL	1	4	1	SHUBHAM REFRIGERATION LUCKNOW	JUGAULI CROSSING VISHWAS KHAND GOMTI NAGAR LUCKNOW LUCKNOW	26.877857	26.877857	26.877857	26.877857	2018-07-04	1	2, Ishwarpuri Colony, Ishwar Puri, Indira Nagar, Lucknow, Uttar Pradesh 226016, India	2, Ishwarpuri Colony, Ishwar Puri, Indira Nagar, Lucknow, Uttar Pradesh 226016, India
969	2091	2018-07-04 13:15:54	NULL	28615	1	NULL	NULL	NULL	1	0	1	DHAVIT ENTERPRISES JAIPUR	SHOP NO G-22 MAHIMA TRINITY P NO 5 SWAGE FARM NEW SANGANER JAIPUR	26.8908	26.8908	0	0	2018-07-04	1	A-21, Swage Farm Rd, Sunder Singh Bhandari Nagar, Ganesh Nagar, Govindpuri, Jaipur, Rajasthan 302019, India	NA
970	2728	2018-07-04 13:16:28	NULL	26662	1	NULL	NULL	NULL	1	0	1	BAJAJ ELECTRONICS PARADISE CIRCLE SECUNDRABAD	D NO 1-7-178,M G ROAD,PARADISE CIRCLE,SECUNDRABAD    HYDERABAD	17.442902	17.442902	0	0	2018-07-04	1	P&T Quarters Complex, Sardar Patel Rd, Sandhu Apartment, Kalasiguda, Secunderabad, Telangana 500003, India	NA
971	2121	2018-07-04 13:17:01	NULL	39324	1	NULL	NULL	NULL	1	0	1	FRONTLINE ELECTRICALS	BLOCK 31 SHOP 6-7 (7/31)SANJAY PALACES AGRA 282005	27.201595	27.201595	0	0	2018-07-04	1	Glory PLaza, U - 3, Mahatma Gandhi Rd, Sursadan X - Ing, Opposite L.I.C. Building, Sanjay Place, Civil Lines, Agra, Uttar Pradesh 282003, India	NA
972	1789	2018-07-04 13:19:06	NULL	37270	1	NULL	NULL	NULL	1	0	1	BAKSHI AUDIO VIDEO DELHI	7838-7839 SARAN BLDG RAM NAGAR MKT PAHARGANJ DELHI 110055	28.646109	28.646109	0	0	2018-07-04	1	11, Ram Nagar Market, Paharganj, New Delhi, Delhi 110055, India	NA
973	112	2018-07-04 13:19:59	2018-07-04 13:21:52	27580	1	NULL	NULL	NULL	1	1	1	VIVEKS JAYA NAGAR BANGALORE	NO36/1, ELEPHANT ROCK RD, 3RD BLOCK, JAYANAGAR BANGALORE-11    BANGALORE	12.91516	12.91516	12.91516	12.91516	2018-07-04	1	Vivek's - J.P. Nagar Showroom, Marenahalli, 2nd Phase, JP Nagar, Bengaluru, Karnataka 560078, India	Vivek's - J.P. Nagar Showroom, Marenahalli, 2nd Phase, JP Nagar, Bengaluru, Karnataka 560078, India
974	855	2018-07-04 13:20:02	2018-07-04 16:32:35	299	1	NULL	NULL	NULL	1	1	2	Chirag marketing	KAMLA AMRUT COMPLEX.NAVJIVAN COMPOUND,KALOL	23.242912	23.242912	23.24077	23.24077	2018-07-04	1	Navjivan Rd, Memon Market, Kalol, Gujarat 382721, India	Navjivan Bazar Road, Navjivan Mill Compound, Memon Market, Kalol, Gujarat 382721, India
975	840	2018-07-04 13:20:21	NULL	23919	1	NULL	NULL	NULL	1	0	1	BOMBAY TELEVISION SERVICE	3 SHALIN COMPLEX OPP FATHEPURA POLICE CHOWKY BHATTA PALDI    AHMEDABAD	23.00726	23.00726	0	0	2018-07-04	1	Freniben Desai Marg, Dungarshinagar, Paldi, Ahmedabad, Gujarat 380007, India	NA
976	2536	2018-07-04 13:20:33	2018-07-04 13:21:05	27616	1	NULL	NULL	NULL	1	1	1	TAJINDER ELECTRONICS	MAIN ROAD, NEW SHIVPURI LUDHIANA PUNJAB 141007	30.934061	30.934061	30.935625	30.935625	2018-07-04	1	232, New Shiv Puri Rd, New Shiv Puri, Ludhiana, Punjab 141008, India	Srinagar - Kanyakumari Hwy, Heera Nagar, Govind Pura, Ludhiana, Punjab 141008, India
977	2587	2018-07-04 13:20:35	NULL	28398	1	NULL	NULL	NULL	1	0	1	AAINA ELECTRONICS LUDHIANA	DOMORIA PULL CIVIL LINES LUDHIANA	30.91962	30.91962	0	0	2018-07-04	1	1255, Domoria Bridge Rd, Civil Lines, Ludhiana, Punjab 141008, India	NA
978	2014	2018-07-04 13:20:43	2018-07-04 13:22:32	40086	1	NULL	NULL	NULL	1	1	1	SHREE MOBILE GALLERY	PLOT NO-5 HANWANT SCHOOL MAIN PAL ROAD JODHPUR 342001	26.267054	26.267054	26.2672	26.2672	2018-07-04	1	E4, Pal Rd, Masuria Colony, Sector-A, Shastri Nagar, Jodhpur, Rajasthan 342003, India	E4, Pal Rd, Masuria Colony, Sector-A, Shastri Nagar, Jodhpur, Rajasthan 342003, India
979	2452	2018-07-04 13:21:13	NULL	300	1	NULL	NULL	NULL	1	0	2	vieks nanaganallur	viveks nanganallur	12.982095	12.982095	0	0	2018-07-04	1	Sai Raja Apartments, 5th Main Rd, Nangainallur, Chennai, Tamil Nadu 600061, India	NA
980	1767	2018-07-04 13:21:14	NULL	11894	1	NULL	NULL	NULL	1	0	1	DHALL ELECTRONICS ADARSH NAGAR	A-262  MAJLIS PARK ADARSH NAGAR 	28.717665	28.717665	0	0	2018-07-04	1	B-188, SS Rana Rd, Block B, Majlis Park, Azadpur, Delhi, 110033, India	NA
981	1842	2018-07-04 13:21:46	NULL	26312	1	NULL	NULL	NULL	1	0	1	RAMA ELECTRO WORLD FARIDABAD	MAIN ROAD OPP SEC-29 NR RAMA SWEET HOUSE OLD FARIDABAD    FARIDABAD	28.428616	28.428616	0	0	2018-07-04	1	1270, Badkhal Rd, Sector 29, Faridabad, Haryana 121008, India	NA
982	2269	2018-07-04 13:21:52	NULL	38128	1	NULL	NULL	NULL	1	0	1	KABIR ENTERPRISES	319-R MODEL TOWN KARNAL	29.70202	29.70202	0	0	2018-07-04	1	Model Town, Karnal, Haryana 132001, India, Model Town	NA
983	2323	2018-07-04 13:22:09	2018-07-04 13:42:53	301	1	NULL	NULL	NULL	1	1	2	Narendar Std Pco	Gohana road Panipat	29.382025	29.382025	29.382128	29.382128	2018-07-04	1	Jammu - Delhi Road, Gaushala Mandi, Jagjivan Ram Colony, Panipat, Haryana 132108, India	Jammu - Delhi Road, Gaushala Mandi, Jagjivan Ram Colony, Panipat, Haryana 132108, India
984	2367	2018-07-04 13:22:17	2018-07-04 13:22:29	302	1	NULL	NULL	NULL	1	1	2	RD KOLATHUR CHENNAI	No 28 29 venus nagar 200 feet ibner ring road	13.125443	13.125443	13.125443	13.125443	2018-07-04	1	Grand Northern Trunk Rd, Annai Sivasakthi Nagar, Lakshmipuram, Chennai, Tamil Nadu 600099, India	Grand Northern Trunk Rd, Annai Sivasakthi Nagar, Lakshmipuram, Chennai, Tamil Nadu 600099, India
985	2298	2018-07-04 13:22:42	2018-07-04 13:29:25	30627	1	NULL	NULL	NULL	1	1	1	LOVELY ELECTRONICS AMBALA	6272/3 JAIN BAZAR GALI PATASIAN WALI AMBALA	30.385221	30.385221	30.385221	30.385221	2018-07-04	1	4721/3, Patel Rd, Jogiwara, Old Town, Ambala, Haryana 133006, India	4721/3, Patel Rd, Jogiwara, Old Town, Ambala, Haryana 133006, India
986	2367	2018-07-04 13:23:20	NULL	303	1	NULL	NULL	NULL	1	0	2	RD KOLATHUR	KOLATHUR	13.1254425	13.1254425	0	0	2018-07-04	1	Grand Northern Trunk Rd, Annai Sivasakthi Nagar, Lakshmipuram, Chennai, Tamil Nadu 600099, India	NA
987	2302	2018-07-04 13:23:40	2018-07-04 13:24:01	32575	1	NULL	NULL	NULL	1	1	1	SAUGAAT AMBALA	105-6 RAI MARKET AMBALA CANTT AMBALA	30.342989	30.342989	30.342989	30.342989	2018-07-04	1	93, Sadar Bazar Road, Palledar Mohalla, Ambala Cantt, Haryana 133001, India	93, Sadar Bazar Road, Palledar Mohalla, Ambala Cantt, Haryana 133001, India
988	2109	2018-07-04 13:23:56	NULL	304	1	NULL	NULL	NULL	1	0	2	Bagra Mobile Point	4no. Dispansery	26.90709	26.90709	0	0	2018-07-04	1	SD-199, ESI Rd, Shanti Nagar, Civil Lines, Jaipur, Rajasthan 302006, India	NA
989	2004	2018-07-04 13:24:29	NULL	305	1	NULL	NULL	NULL	1	0	2	Great Eastern Trading Company	Shop no 56,57,58 SF tower akhliya circle	26.278181	26.278181	0	0	2018-07-04	1	Soorsagar Rd, 1st Pulia, Jodhpur, Rajasthan 342003, India	NA
990	2209	2018-07-04 13:24:43	2018-07-04 13:24:43	24310	1	NULL	NULL	NULL	1	4	1	SHUBHAM REFRIGERATION LUCKNOW	JUGAULI CROSSING VISHWAS KHAND GOMTI NAGAR LUCKNOW LUCKNOW	26.877842	26.877842	26.877842	26.877842	2018-07-04	1	2, Ishwarpuri Colony, Ishwar Puri, Indira Nagar, Lucknow, Uttar Pradesh 226016, India	2, Ishwarpuri Colony, Ishwar Puri, Indira Nagar, Lucknow, Uttar Pradesh 226016, India
991	2014	2018-07-04 13:25:27	NULL	40086	1	NULL	NULL	NULL	1	0	1	SHREE MOBILE GALLERY	PLOT NO-5 HANWANT SCHOOL MAIN PAL ROAD JODHPUR 342001	26.2672	26.2672	0	0	2018-07-04	1	E4, Pal Rd, Masuria Colony, Sector-A, Shastri Nagar, Jodhpur, Rajasthan 342003, India	NA
992	2209	2018-07-04 13:25:30	2018-07-04 13:25:31	24310	1	NULL	NULL	NULL	1	4	1	SHUBHAM REFRIGERATION LUCKNOW	JUGAULI CROSSING VISHWAS KHAND GOMTI NAGAR LUCKNOW LUCKNOW	26.87784	26.87784	26.87784	26.87784	2018-07-04	1	2, Ishwarpuri Colony, Ishwar Puri, Indira Nagar, Lucknow, Uttar Pradesh 226016, India	2, Ishwarpuri Colony, Ishwar Puri, Indira Nagar, Lucknow, Uttar Pradesh 226016, India
993	1795	2018-07-04 13:26:00	NULL	11833	1	NULL	NULL	NULL	1	0	1	WORLD VOICE PAHARGANJ	1 RAM NAGAR PAHARGANJ NEW DELHI 	28.64544	28.64544	0	0	2018-07-04	1	8591, Qutab Rd, Ram Nagar, Paharganj, New Delhi, Delhi 110055, India	NA
994	2209	2018-07-04 13:26:53	2018-07-04 13:26:54	24310	1	NULL	NULL	NULL	1	4	1	SHUBHAM REFRIGERATION LUCKNOW	JUGAULI CROSSING VISHWAS KHAND GOMTI NAGAR LUCKNOW LUCKNOW	26.87784	26.87784	26.87784	26.87784	2018-07-04	1	2, Ishwarpuri Colony, Ishwar Puri, Indira Nagar, Lucknow, Uttar Pradesh 226016, India	2, Ishwarpuri Colony, Ishwar Puri, Indira Nagar, Lucknow, Uttar Pradesh 226016, India
995	3067	2018-07-04 13:27:04	2018-07-04 13:27:20	31596	1	NULL	NULL	NULL	1	1	1	BIG CMOBILES PVT LTD BAJI JUNCTION VISAKHAPATNAM	Main Road, Nad Kotha Road Baji Junction	17.743692	17.743692	17.743692	17.743692	2018-07-04	1	# 58-1-357, NAD Kotha Rd, Nad Junction, Buchirajupalem, Gopalapatnam, Dungalavanipalem, Visakhapatnam, Andhra Pradesh 530027, India	# 58-1-357, NAD Kotha Rd, Nad Junction, Buchirajupalem, Gopalapatnam, Dungalavanipalem, Visakhapatnam, Andhra Pradesh 530027, India
996	2209	2018-07-04 13:27:10	2018-07-04 13:27:16	28015	1	NULL	NULL	NULL	1	1	1	GULATI ELECTRONICS SALES LUCKNOW	E-3290/2,RAJAJIPURAM LUCKNOW	26.87784	26.87784	26.87784	26.87784	2018-07-04	1	2, Ishwarpuri Colony, Ishwar Puri, Indira Nagar, Lucknow, Uttar Pradesh 226016, India	2, Ishwarpuri Colony, Ishwar Puri, Indira Nagar, Lucknow, Uttar Pradesh 226016, India
997	2209	2018-07-04 13:27:23	2018-07-04 13:27:24	24310	1	NULL	NULL	NULL	1	4	1	SHUBHAM REFRIGERATION LUCKNOW	JUGAULI CROSSING VISHWAS KHAND GOMTI NAGAR LUCKNOW LUCKNOW	26.877836	26.877836	26.877836	26.877836	2018-07-04	1	2, Ishwarpuri Colony, Ishwar Puri, Indira Nagar, Lucknow, Uttar Pradesh 226016, India	2, Ishwarpuri Colony, Ishwar Puri, Indira Nagar, Lucknow, Uttar Pradesh 226016, India
998	1173	2018-07-04 13:27:23	NULL	306	1	NULL	NULL	NULL	1	0	2	KHOSLA KANKURGACHI	P-23 MANICKTALA MAIN ROAD KOLKATA-700054	22.580845	22.580845	0	0	2018-07-04	1	223c, Maniktala Main Rd, Manicktala, Bagmari, Kolkata, West Bengal 700054, India	NA
999	1673	2018-07-04 13:27:30	2018-07-04 13:27:37	23976	1	NULL	NULL	NULL	1	1	1	TANEJA ELECTRONICSS UTTAM NAGAR	A-13 MILAP NAGAR MAIN NAJAFGARH ROAD UTTAM NAGAR    DELHI	28.62382	28.62382	28.62382	28.62382	2018-07-04	1	B-31, Shivaji Marg, Pocket 4, Zamrudpur, JJ Colony, Uttam Nagar, Delhi, 110066, India	B-31, Shivaji Marg, Pocket 4, Zamrudpur, JJ Colony, Uttam Nagar, Delhi, 110066, India
1000	2209	2018-07-04 13:27:47	2018-07-04 13:27:48	24310	1	NULL	NULL	NULL	1	4	1	SHUBHAM REFRIGERATION LUCKNOW	JUGAULI CROSSING VISHWAS KHAND GOMTI NAGAR LUCKNOW LUCKNOW	26.877853	26.877853	26.877853	26.877853	2018-07-04	1	2, Ishwarpuri Colony, Ishwar Puri, Indira Nagar, Lucknow, Uttar Pradesh 226016, India	2, Ishwarpuri Colony, Ishwar Puri, Indira Nagar, Lucknow, Uttar Pradesh 226016, India
1001	2482	2018-07-04 13:28:00	NULL	307	1	NULL	NULL	NULL	1	0	2	POORVIKA Avadi	Avadi	13.121648	13.121648	0	0	2018-07-04	1	125, Madras Thiruvallur High Rd, Ram Nagar, Ambattur, Chennai, Tamil Nadu 600053, India	NA
1002	112	2018-07-04 13:28:01	2018-07-04 13:28:03	31210	1	NULL	NULL	NULL	1	4	1	HAAVIT RETAIL HOSUR ROAD BANGALORE	SONY CENTER HAAVIT RETAIL SPAN CENTER NO 8/1P, OPPS AUDI CAR SHOWROOM HOSUR MAIN ROAD NEAR ELECTRONICS CITY PAHSE-1, BANGALORE	12.915157	12.915157	12.915157	12.915157	2018-07-04	1	Vivek's - J.P. Nagar Showroom, Marenahalli, 2nd Phase, JP Nagar, Bengaluru, Karnataka 560078, India	Vivek's - J.P. Nagar Showroom, Marenahalli, 2nd Phase, JP Nagar, Bengaluru, Karnataka 560078, India
1003	2209	2018-07-04 13:28:04	2018-07-04 15:01:08	28015	1	NULL	NULL	NULL	1	4	1	GULATI ELECTRONICS SALES LUCKNOW	E-3290/2,RAJAJIPURAM LUCKNOW	26.877853	26.877853	26.877846	26.877846	2018-07-04	1	2, Ishwarpuri Colony, Ishwar Puri, Indira Nagar, Lucknow, Uttar Pradesh 226016, India	2, Ishwarpuri Colony, Ishwar Puri, Indira Nagar, Lucknow, Uttar Pradesh 226016, India
1004	2536	2018-07-04 13:28:04	2018-07-04 13:28:44	27428	1	NULL	NULL	NULL	1	1	1	PARADISE RADIO	NEAR VED BHARTI ASHRAM SHIV PURI ROAD LUDHIANA	30.934021	30.934021	30.934021	30.934021	2018-07-04	1	544, Street Number 11, Master Colony, New Shiv Puri, Ludhiana, Punjab 141008, India	544, Street Number 11, Master Colony, New Shiv Puri, Ludhiana, Punjab 141008, India
1005	1136	2018-07-04 13:28:16	NULL	30243	1	NULL	NULL	NULL	1	0	1	GREAT EASTERN APPLIANCES PVT LTD BAPUJI NAGAR BHUBANESHWAR	PLOT NO-22 22B JANPATH BAPUJI NAGAR BHUBANESHWAR	20.258335	20.258335	0	0	2018-07-04	1	26, Jan Path, Bapuji Nagar, Bhubaneswar, Odisha 751009, India	NA
1006	3067	2018-07-04 13:28:33	NULL	31596	1	NULL	NULL	NULL	1	0	1	BIG CMOBILES PVT LTD BAJI JUNCTION VISAKHAPATNAM	Main Road, Nad Kotha Road Baji Junction	17.744104	17.744104	0	0	2018-07-04	1	# 58-1-357, NAD Kotha Rd, Nad Junction, Buchirajupalem, Gopalapatnam, Dungalavanipalem, Visakhapatnam, Andhra Pradesh 530027, India	NA
1007	2148	2018-07-04 13:28:38	NULL	35463	1	NULL	NULL	NULL	1	0	1	WASU ELECTRONICS DEHRADUN	MOTI BAZAR DEHRADUN	30.321655	30.321655	0	0	2018-07-04	1	45, Moti Bazar, Ajit Prasad Nagar, Paltan Bazaar, Dehradun, Uttarakhand 248001, India	NA
1008	1844	2018-07-04 13:29:14	NULL	31042	1	NULL	NULL	NULL	1	0	1	VIJAY SALES FARIDABAD	CROWN PLAZA, 29KM MILESHONE, SECTOR 15A, FARIDABAD, HARYANA - 121007	28.397285	28.397285	0	0	2018-07-04	1	5B, Azad Colony, Sector 15A, Faridabad, Haryana 121007, India	NA
1009	562	2018-07-04 13:29:41	2018-07-04 15:01:26	38123	1	NULL	NULL	NULL	1	1	1	NEW MOBILE POINT	GF 13 RAHUL TOWER O 100FT ROAD SATELLITE AHMEDABAD 380015	23.012892	23.012892	23.012892	23.012892	2018-07-04	1	Anand Nagar Rd, Jodhpur Village, Jodhpur, Ahmedabad, Gujarat 380015, India	Anand Nagar Rd, Jodhpur Village, Jodhpur, Ahmedabad, Gujarat 380015, India
1010	2277	2018-07-04 13:30:17	NULL	43178	1	NULL	NULL	NULL	1	0	1	NAGPAL SALES CORPORATION	SHOP NO 3 URBAN ESTATE OLD CHAR CHAMAN LINK ROAD 132001	29.689058	29.689058	0	0	2018-07-04	1	356, Old Char Chaman, Dyal Singh Colony, Karnal, Haryana 132001, India	NA
1011	2010	2018-07-04 13:30:13	2018-07-04 13:30:59	29852	1	NULL	NULL	NULL	1	1	1	RAINBOW ELECTRONICS JODHPUR	FRIGO BULIDING 1ST C ROAD NEAR GOL BUILDING SADARPURA JODHPUR	26.27952	26.27952	26.27952	26.27952	2018-07-04	1	Frigo Building, 1st C Rd, Sardarpura, Jodhpur, Rajasthan 342003, India	Frigo Building, 1st C Rd, Sardarpura, Jodhpur, Rajasthan 342003, India
1012	2303	2018-07-04 13:30:44	NULL	39064	1	NULL	NULL	NULL	1	0	1	ASHOKA ENTERPRISE	PLOT NO-285 PHASE-2 HSIIDC SAHA AMBALA CANTT AMBALA HARYANA 133001	30.297075	30.297075	0	0	2018-07-04	1	SH 31, Saha, Haryana 133101, India	NA
1013	2010	2018-07-04 13:31:38	2018-07-04 13:32:08	29852	1	NULL	NULL	NULL	1	1	1	RAINBOW ELECTRONICS JODHPUR	FRIGO BULIDING 1ST C ROAD NEAR GOL BUILDING SADARPURA JODHPUR	26.279543	26.279543	26.279543	26.279543	2018-07-04	1	Frigo Building, 1st C Rd, Sardarpura, Jodhpur, Rajasthan 342003, India	Frigo Building, 1st C Rd, Sardarpura, Jodhpur, Rajasthan 342003, India
1014	2074	2018-07-04 13:32:00	NULL	308	1	NULL	NULL	NULL	1	0	2	Mobile Gallery	128-129 parnami mandie ke pass raja park jaipur	26.89835	26.89835	0	0	2018-07-04	1	8, Govind Marg, Anand Puri, Gurunanakpura, Tilak Nagar, Jaipur, Rajasthan 302004, India	NA
1015	2010	2018-07-04 13:32:29	NULL	39881	1	NULL	NULL	NULL	1	0	1	MANGALAM BATTERIES	1ST C ROAD SAROARPURA NEAR HINO COLLEGE JODHPUR 342001	26.279667	26.279667	0	0	2018-07-04	1	Frigo Building, 1st C Rd, Sardarpura, Jodhpur, Rajasthan 342003, India	NA
1016	2000	2018-07-04 13:32:33	NULL	28480	1	NULL	NULL	NULL	1	0	1	RAJ AGENCY JODHPUR	51 1 TAK BHAWAN NEAR VODAFONE STORE 12TH RESIDENCY JODHPUR	26.278091	26.278091	0	0	2018-07-04	1	Soorsagar Rd, 1st Pulia, Jodhpur, Rajasthan 342003, India	NA
1017	2766	2018-07-04 13:32:38	2018-07-04 14:01:56	27545	1	NULL	NULL	NULL	1	4	1	BAJAJ ELECTRONICS ATTAPUR	PILLER NO 138,SY NO 400 PART,ATTAPUR,RAJENDRANAGAR,HYDEARABAD    HYDERABAD	17.36657	17.36657	17.36657	17.36657	2018-07-04	1	3-4-174/A/4/1, Inner Ring Rd, Radha Krishna Nagar, Attapur, Hyderabad, Telangana 500030, India	3-4-174/A/4/1, Inner Ring Rd, Radha Krishna Nagar, Attapur, Hyderabad, Telangana 500030, India
1018	1924	2018-07-04 13:33:08	NULL	25021	1	NULL	NULL	NULL	1	0	1	RD SHIPRA MALL NCR	1st Floor, Shipra Mall,Shipra Sun City,9 Vaibhav Khand,Indirapuram,-201012	28.634903	28.634903	0	0	2018-07-04	1	C-103, Outer Cir, Vaibhav Khand, Indirapuram, Ghaziabad, Uttar Pradesh 201014, India	NA
1019	1292	2018-07-04 13:33:21	NULL	309	1	NULL	NULL	NULL	1	0	2	Khosla Electronics Kankurgachi	P-23 Maniktala Main Road Kolkata -700054	19.006762	72.83275	0	0	2018-07-04	1	Capital First Ltd., One Indiabulls Centre, Tower 2A and 2B, 10th Floor, Senapati Bapat Marg, Lower Parel (West), Saidham Nagar, Parel, Mumbai, Maharashtra 400013	NA
1020	2298	2018-07-04 13:33:27	NULL	30627	1	NULL	NULL	NULL	1	0	1	LOVELY ELECTRONICS AMBALA	6272/3 JAIN BAZAR GALI PATASIAN WALI AMBALA	30.385515	30.385515	0	0	2018-07-04	1	4721/3, Patel Rd, Jogiwara, Old Town, Ambala, Haryana 133006, India	NA
1021	675	2018-07-04 13:33:36	NULL	310	1	NULL	NULL	NULL	1	0	2	RD MANGALDEEP VARACHHA 6369	Reliance digital Mangaldeep Complex Varachha Opp Police Station Surat 395006	21.209904	21.209904	0	0	2018-07-04	1	14, Surat - Kamrej Hwy, Ashok Colony, Kodiyar Nagar, Surat, Gujarat 395006, India	NA
