id	user_id	check_in	check_out	store_id	checkin_type	is_first_checkin	created_at	updated_at	so_id	checkout_type	store_type	store_name	store_address	map_in_lat	map_in_long	map_out_lat	map_out_long	check_in_date	check_in_status	check_in_address	check_out_address
315	2507	2018-07-04 11:31:42	2018-07-04 16:23:28	30812	1	NULL	NULL	NULL	1	4	1	RD ADYAR CHENNAI	PLOT NO 52, 1ST MAIN ROAD GANDHI NAGAR, ADYAR CHENNAI	13.008951	13.008951	19.006762	72.83275	2018-07-04	1	25, Adyar Bridge Road, Gandhi Nagar, Adyar, Chennai, Tamil Nadu 600020, India	Capital First Ltd., One Indiabulls Centre, Tower 2A and 2B, 10th Floor, Senapati Bapat Marg, Lower Parel (West), Saidham Nagar, Parel, Mumbai, Maharashtra 400013
316	2966	2018-07-04 11:31:58	2018-07-04 19:32:02	41305	1	NULL	NULL	NULL	1	6	1	TIRUPATI MOBILES CENTRE	29/37/163 ELURUROAD VIJAYWADA NEAR VIJAYA BANK OPP SONOVISION ELURUROAD VIJAYWADA 520002	16.513887	16.513887	0	0	2018-07-04	1	# 28-1-42, Eluru Rd, Arundalpet, Governorpet, Vijayawada, Andhra Pradesh 520002, India	NA
317	1857	2018-07-04 11:32:00	2018-07-04 19:32:02	95	1	NULL	NULL	NULL	1	6	2	GEETA SALES CORPORATION	SHOP NO 595 22 FEET ROAD SANJAY COLONY SECTOR 23 NIT FARIDABAD NEAR GALI NO 53 121005	28.36429	28.36429	0	0	2018-07-04	1	1055, Shanti Niketan School Rd, Block G, Jawahar Colony, Faridabad, Haryana 121005, India	NA
318	3095	2018-07-04 11:32:06	2018-07-04 14:35:37	96	1	NULL	NULL	NULL	1	1	2	Sowndarya Shoppe Gajuwaka 2	Fun plaza new gajuwaka visakhapatnam	17.685575	17.685575	17.686047	17.686047	2018-07-04	1	10-10-52/3, GNT Rd, New Gajuwaka, Gajuwaka, Visakhapatnam, Andhra Pradesh 530026, India	10-10-22, Gajuwaka, Visakhapatnam, Andhra Pradesh 530026, India
319	3130	2018-07-04 11:32:20	2018-07-04 19:33:01	24238	1	NULL	NULL	NULL	1	6	1	SATHYA AGENCIES PRIVATE LIMITED RS PURAM COIMBATORE	TV SWAMY ROAD EAST,R S PURAM, NEAR POST OFFICE, COIMBATORE,TAMIL NADU	11.010379	11.010379	0	0	2018-07-04	1	21/1, E TV Swamy Rd, R.S. Puram, Coimbatore, Tamil Nadu 641002, India	NA
320	1983	2018-07-04 11:32:32	2018-07-04 11:32:53	39473	1	NULL	NULL	NULL	1	4	1	ARB DIGITAL POINT	I-43 HARI NAGAR EXT SAURABH VIHAR BADARPUR 110044	28.50505	28.50505	28.50505	28.50505	2018-07-04	1	S-105, Jaitpur Rd, Hari Nagar Extn, Saurabh Vihar, Jaitpur, Badarpur, Haryana 110044, India	S-105, Jaitpur Rd, Hari Nagar Extn, Saurabh Vihar, Jaitpur, Badarpur, Haryana 110044, India
321	1695	2018-07-04 11:32:44	2018-07-04 19:33:01	12120	1	NULL	NULL	NULL	1	6	1	AUDIOTECH MOTIBAGH	29 BASURKAR MARKET MOTI BAGH 1	28.581875	28.581875	0	0	2018-07-04	1	Basrurkar Market Road, Block D, Moti Bagh, New Delhi, Delhi 110021, India	NA
322	1015	2018-07-04 11:32:47	2018-07-04 12:02:48	31453	1	NULL	NULL	NULL	1	4	1	GREAT EASTERN APPLIANCES PRIVATE LIMITED BADAMBADI CUTTACK	PLOT NO-45,MAIN ROAD BADAMBADI CUTTACK	20.457981	20.457981	20.458723	20.458723	2018-07-04	1	Link Rd, Old LIC Colony, Cuttack, Odisha 753009, India	Badambadi Colony, Cuttack, Odisha, India, Badambadi Colony
323	1719	2018-07-04 11:32:49	2018-07-04 19:33:01	97	1	NULL	NULL	NULL	1	6	2	Dhingra Electronics	A-222/1 insurance wali gali ambedkar colony chattarpur 110074	28.506807	28.506807	0	0	2018-07-04	1	Dr Ambedkar Marg, Desu Colony, Chhattarpur, New Delhi, Delhi 110030, India	NA
324	3079	2018-07-04 11:32:50	2018-07-04 16:59:49	98	1	NULL	NULL	NULL	1	1	2	Sonovision JN Road	Jn road	17.00735	17.00735	17.00735	17.00735	2018-07-04	1	Jawaharlal Nehru Rd, Gandhipuram, Rajahmundry, Andhra Pradesh 533103, India	Jawaharlal Nehru Rd, Gandhipuram, Rajahmundry, Andhra Pradesh 533103, India
325	2568	2018-07-04 11:33:01	2018-07-04 12:27:32	23635	1	NULL	NULL	NULL	1	1	1	NEXUS ELECTRONICS LUDHIANA	44-A, Kim RK Tower, Lower Ground Floor, Rishi Nagar, Ludhiana.	30.917135	30.917135	30.917135	30.917135	2018-07-04	1	47, SH20, Balmiki Nagar, Rishi Nagar, Ludhiana, Punjab 141004, India	47, SH20, Balmiki Nagar, Rishi Nagar, Ludhiana, Punjab 141004, India
326	3133	2018-07-04 11:33:07	2018-07-04 11:33:49	35584	1	NULL	NULL	NULL	1	1	1	BHARATH ELECTRONICS AND APPLIANCES COIMBATORE	383 100 FEET ROAD GANDHIPURAM COIMBATORE 641012	11.019589	11.019589	11.019589	11.019589	2018-07-04	1	60, 7th Street, Tatabad, Gandhipuram, Coimbatore, Tamil Nadu 641012, India	60, 7th Street, Tatabad, Gandhipuram, Coimbatore, Tamil Nadu 641012, India
327	1983	2018-07-04 11:33:17	2018-07-04 12:32:43	39473	1	NULL	NULL	NULL	1	4	1	ARB DIGITAL POINT	I-43 HARI NAGAR EXT SAURABH VIHAR BADARPUR 110044	28.50505	28.50505	28.505072	28.505072	2018-07-04	1	S-105, Jaitpur Rd, Hari Nagar Extn, Saurabh Vihar, Jaitpur, Badarpur, Haryana 110044, India	S-105, Jaitpur Rd, Hari Nagar Extn, Saurabh Vihar, Jaitpur, Badarpur, Haryana 110044, India
328	129	2018-07-04 11:33:21	2018-07-04 19:34:01	34	1	NULL	NULL	NULL	1	6	1	Capital First Nashik	Capital First Ltd. 4th Floor, Office No. 401 & 402, Sahayadree Business Park INC, MICO Circle Point Trambak Road, Tidke Colony, Above Hyundai Showroom, Nashik, Maharashtra, India 422002	19.993582	19.993582	0	0	2018-07-04	1	MICO Circle, Patrakar Colony, Parijat Nagar, Nashik, Maharashtra 422002, India	NA
329	3185	2018-07-04 11:33:23	2018-07-04 19:34:01	99	1	NULL	NULL	NULL	1	6	2	Girias Investment Pvt Ltd	South masi street	9.915886	9.915886	0	0	2018-07-04	1	82, S Masi St, Valaiyal Kadai, Madurai Main, Madurai, Tamil Nadu 625001, India	NA
330	3051	2018-07-04 11:33:26	2018-07-04 14:02:01	31592	1	NULL	NULL	NULL	1	1	1	BIG CMOBILES PVT LTD OPP INIDA POST VISAKHAPATNAM	ADJACENT VIMAL SHOWROOM, OPP.INDIA POST, DABAGARDENS., VISAKAPATNAM,,A.P	17.719019	17.719019	17.718994	17.718994	2018-07-04	1	Sri Laxminursimha Commercial Complex, 30-15-135, Lalitha Colony, Nehru Nagar, Ram Nagar, Visakhapatnam, Andhra Pradesh 530004, India	Sri Laxminursimha Commercial Complex, 30-15-135, Lalitha Colony, Nehru Nagar, Ram Nagar, Visakhapatnam, Andhra Pradesh 530004, India
331	2799	2018-07-04 11:33:34	2018-07-04 11:35:06	30491	1	NULL	NULL	NULL	1	1	1	BAJAJ ELECTRONICS KARMANGHAT HYDERABAD	PLOT NO 40,41, 42 43,SAGAR ROAD KARMANGHAT HYDERABAD	17.345285	17.345285	17.345285	17.345285	2018-07-04	1	India(IN)_Andhra Pradesh_Hyderabad, Hyderabad, Hyderabad, Andhra Pradesh, India	India(IN)_Andhra Pradesh_Hyderabad, Hyderabad, Hyderabad, Andhra Pradesh, India
332	1359	2018-07-04 11:33:43	2018-07-04 19:34:01	100	1	NULL	NULL	NULL	1	6	2	Yelhanka Adishwar	Near Sharavathi bus stand	13.098473	13.098473	0	0	2018-07-04	1	sai vandhana complex, 3rd B Cross Road, Yelahanka Satellite Town, Yelahanka, Bengaluru, Karnataka 560064, India	NA
333	798	2018-07-04 11:33:52	2018-07-04 13:56:41	101	1	NULL	NULL	NULL	1	1	2	Mohan Refrigeration And Electronics	Krishnanagar Naroda	23.039644	23.039644	23.020144	23.020144	2018-07-04	1	Nikol-Odhav Rd, Nicol Gam, Nikol, Ahmedabad, Gujarat 382350, India	382-A/20, Soni Ni Chawl Rd, Rehmat Nagar, Rakhial, Ahmedabad, Gujarat 380024, India
334	1899	2018-07-04 11:33:55	2018-07-04 19:34:01	26273	1	NULL	NULL	NULL	1	6	1	SARGAM INDIA ELECTRONICS ATTA MARKET NOIDA	B-1/33 DD COMPLEX SECTOR 18 ATTA MARKET NOIDA	28.56898	28.56898	0	0	2018-07-04	1	P-20, Sector 2, P Block, Pocket I, Sector 18, Noida, Uttar Pradesh 201301, India	NA
335	1077	2018-07-04 11:33:57	2018-07-04 19:34:01	26375	1	NULL	NULL	NULL	1	6	1	TARANGS G S ROAD GUWAHATI	GS ROAD, ULUBARI, NEAR KFC, PIN 781007	26.151852	26.151852	0	0	2018-07-04	1	KK Boro Building, Rajbari Path, Christian Basti, Guwahati, Assam 781034, India	NA
336	1980	2018-07-04 11:34:05	2018-07-04 19:35:01	12047	1	NULL	NULL	NULL	1	6	1	V K ELECTRONICS BADARPUR	SHOP NO-2 MEETHAPUR CHOWK JAITPUR ROAD BADARPUR	28.501188	28.501188	0	0	2018-07-04	1	112/A, Jaitpur Rd, Hari Nagar Extn, Hari Nagar, Badarpur, New Delhi, Haryana 110044, India	NA
337	806	2018-07-04 11:34:08	2018-07-04 11:34:09	11529	1	NULL	NULL	NULL	1	4	1	VISHWAKARMA ELECTRONICS	5, DHULIBA COMPLEXA, NEAR CHANDLODIA OVER BRIDGE, CHANDLODIA, AHMEDABAD - 382481	23.080235	23.080235	23.080235	23.080235	2018-07-04	1	Chandlodia Rd, KK Nagar, Gayatri Nagar, Chandlodiya, Ahmedabad, Gujarat 382481, India	Chandlodia Rd, KK Nagar, Gayatri Nagar, Chandlodiya, Ahmedabad, Gujarat 382481, India
338	1767	2018-07-04 11:34:10	2018-07-04 11:34:18	11894	1	NULL	NULL	NULL	1	4	1	DHALL ELECTRONICS ADARSH NAGAR	A-262  MAJLIS PARK ADARSH NAGAR 	28.71758	28.71758	28.71758	28.71758	2018-07-04	1	B-188, SS Rana Rd, Block B, Majlis Park, Azadpur, Delhi, 110033, India	B-188, SS Rana Rd, Block B, Majlis Park, Azadpur, Delhi, 110033, India
339	1875	2018-07-04 11:34:10	2018-07-04 19:35:01	13197	1	NULL	NULL	NULL	1	6	1	NAVRANG AUDIO VIDEO PVT LTD VIKAS MARG	D-10 VIKAS MARG LAXMI NAGAR DELHI	28.632116	28.632116	0	0	2018-07-04	1	Street Number 1, Block D, Laxmi Nagar, New Delhi, Delhi 110031, India	NA
340	2572	2018-07-04 11:34:17	2018-07-04 11:37:00	102	1	NULL	NULL	NULL	1	1	2	Siraj Enterprises	1354 HAMBRAN ROAD LUDHIANA NR RAM SHRANAM	30.916641	30.916641	19.006762	72.83275	2018-07-04	1	2167, SH20, Haibowal Kalan, Ludhiana, Punjab 141004, India	Capital First Ltd., One Indiabulls Centre, Tower 2A and 2B, 10th Floor, Senapati Bapat Marg, Lower Parel (West), Saidham Nagar, Parel, Mumbai, Maharashtra 400013
341	1230	2018-07-04 11:34:24	2018-07-04 16:27:27	12303	1	NULL	NULL	NULL	1	4	1	PATRA ELECTRONICS BADAMBADI CUTTACK	JAYASHREE PLAZA,BADAMBADI.CUTTACK  	20.459705	20.459705	20.459606	20.459606	2018-07-04	1	Jayshree Plaza, Kathajodi Rd, Badambadi Colony, Cuttack, Odisha 753009, India	Bharatia Tower, Link Rd, Badambadi Colony, Cuttack, Odisha 753009, India
342	2991	2018-07-04 11:34:25	2018-07-04 11:38:20	25097	1	NULL	NULL	NULL	1	2	1	SONOVISION ARUNDAL PET VIJAYAWADA	# 28-8-7,annadhanam samjam road, opp fire station Vinoda Thearter Arundelpet Vijawayada	16.514874	16.514874	16.514874	16.514874	2018-07-04	1	Annadana Samajam St, Arundalpet, Governorpet, Vijayawada, Andhra Pradesh 520002, India	Annadana Samajam St, Arundalpet, Governorpet, Vijayawada, Andhra Pradesh 520002, India
343	806	2018-07-04 11:34:27	2018-07-04 11:34:27	11529	1	NULL	NULL	NULL	1	4	1	VISHWAKARMA ELECTRONICS	5, DHULIBA COMPLEXA, NEAR CHANDLODIA OVER BRIDGE, CHANDLODIA, AHMEDABAD - 382481	23.080235	23.080235	23.080235	23.080235	2018-07-04	1	Chandlodia Rd, KK Nagar, Gayatri Nagar, Chandlodiya, Ahmedabad, Gujarat 382481, India	Chandlodia Rd, KK Nagar, Gayatri Nagar, Chandlodiya, Ahmedabad, Gujarat 382481, India
344	1978	2018-07-04 11:34:26	2018-07-04 19:35:01	103	1	NULL	NULL	NULL	1	6	2	MEHTA ENTERPRISES DELHI	jaitpur	28.504255	28.504255	0	0	2018-07-04	1	Jaitpur Tyagiji Road, F- Block, Molarband, New Delhi, Delhi 110044, India	NA
345	1767	2018-07-04 11:34:32	2018-07-04 13:02:31	11894	1	NULL	NULL	NULL	1	4	1	DHALL ELECTRONICS ADARSH NAGAR	A-262  MAJLIS PARK ADARSH NAGAR 	28.717588	28.717588	28.711845	28.711845	2018-07-04	1	B-188, SS Rana Rd, Block B, Majlis Park, Azadpur, Delhi, 110033, India	Azadpur Flyover, Kewal Park Extension, Kewal Park, Azadpur, Delhi, 110009, India
346	2715	2018-07-04 11:34:39	2018-07-04 11:35:10	26662	1	NULL	NULL	NULL	1	1	1	BAJAJ ELECTRONICS PARADISE CIRCLE SECUNDRABAD	D NO 1-7-178,M G ROAD,PARADISE CIRCLE,SECUNDRABAD    HYDERABAD	17.440725	17.440725	17.440725	17.440725	2018-07-04	1	1-7-178, 182 to 184, Mahatma Gandhi Rd, Bhaskar Residency, Nallagutta, Ramgopalpet, Hyderabad, Telangana 500003, India	1-7-178, 182 to 184, Mahatma Gandhi Rd, Bhaskar Residency, Nallagutta, Ramgopalpet, Hyderabad, Telangana 500003, India
347	1884	2018-07-04 11:34:46	2018-07-04 19:35:01	104	1	NULL	NULL	NULL	1	6	2	Bansiwala Store	shop no 01 gamma 2 greater noida	28.488045	28.488045	0	0	2018-07-04	1	1, Gamma Main Rd, Block G, Gamma II, Greater Noida, Uttar Pradesh 201310, India	NA
348	806	2018-07-04 11:34:48	2018-07-04 11:34:48	11529	1	NULL	NULL	NULL	1	4	1	VISHWAKARMA ELECTRONICS	5, DHULIBA COMPLEXA, NEAR CHANDLODIA OVER BRIDGE, CHANDLODIA, AHMEDABAD - 382481	23.080338	23.080338	23.080338	23.080338	2018-07-04	1	30, Ambica Anandmayi Society, Near A.D.C. Bank, Ghansyam Nagar Part 2, Gayatri Nagar, Chandlodiya, Ahmedabad, Gujarat 382481, India	30, Ambica Anandmayi Society, Near A.D.C. Bank, Ghansyam Nagar Part 2, Gayatri Nagar, Chandlodiya, Ahmedabad, Gujarat 382481, India
349	1862	2018-07-04 11:34:53	2018-07-04 19:35:01	30804	1	NULL	NULL	NULL	1	6	1	JAIN ELECTRO WORLD DELHI	C-5/82,77 NEW KONDLI DELHI	28.604317	28.604317	0	0	2018-07-04	1	C-5/89, New Kondli Rd, Buddh Vihar, Pocket C 3, Mayur Vihar Phase III, Kondli, ?? ??????, Uttar Pradesh 110096, India	NA
350	806	2018-07-04 11:35:01	2018-07-04 11:35:01	11529	1	NULL	NULL	NULL	1	4	1	VISHWAKARMA ELECTRONICS	5, DHULIBA COMPLEXA, NEAR CHANDLODIA OVER BRIDGE, CHANDLODIA, AHMEDABAD - 382481	23.080278	23.080278	23.080278	23.080278	2018-07-04	1	30, Ambica Anandmayi Society, Near A.D.C. Bank, Ghansyam Nagar Part 2, Gayatri Nagar, Chandlodiya, Ahmedabad, Gujarat 382481, India	30, Ambica Anandmayi Society, Near A.D.C. Bank, Ghansyam Nagar Part 2, Gayatri Nagar, Chandlodiya, Ahmedabad, Gujarat 382481, India
351	135	2018-07-04 11:34:14	2018-07-04 19:35:01	34	1	NULL	NULL	NULL	1	6	1	Capital First Nashik	Capital First Ltd. 4th Floor, Office No. 401 & 402, Sahayadree Business Park INC, MICO Circle Point Trambak Road, Tidke Colony, Above Hyundai Showroom, Nashik, Maharashtra, India 422002	19.993637	19.993637	0	0	2018-07-04	1	Untwadi Rd, Patrakar Colony, Parijat Nagar, Nashik, Maharashtra 422002, India	NA
352	2093	2018-07-04 11:35:04	2018-07-04 19:36:01	27730	1	NULL	NULL	NULL	1	6	1	SHREE SIDHI VINAYAK ELECTROTECH JAIPUR	278/19,MAIN MALAPURA ROAD,SANGANER JAIPUR	26.814579	26.814579	0	0	2018-07-04	1	11, RJ SH 12, Dada Gurudev Nagar, Sanganer, Jaipur, Rajasthan 302029, India	NA
353	856	2018-07-04 11:35:11	2018-07-04 13:47:31	27439	1	NULL	NULL	NULL	1	4	1	UMA SALES	78/79, 4D SQURE OPP IIT COLLEGE, NEAR D-MART, VISAT TO GANDHINAGAR HIGHWAY, AHMEDABAD - 382424	23.102615	23.102615	23.105333	23.105333	2018-07-04	1	Gujarat State Highway 71, Chandkheda, Ahmedabad, Gujarat 382424, India	13, Motera, Ahmedabad, Gujarat 382424, India
354	2679	2018-07-04 11:35:25	2018-07-04 11:36:16	105	1	NULL	NULL	NULL	1	1	2	Bajaj Electronic Kompally	Dno.04-009/nr(old no.3-24) survey no.43 near suchitra circle kompally	17.509905	17.509905	17.509905	17.509905	2018-07-04	1	23, NH 44, Bashirabad, Jeedimetla, Hyderabad, Telangana 500010, India	23, NH 44, Bashirabad, Jeedimetla, Hyderabad, Telangana 500010, India
355	2799	2018-07-04 11:35:30	2018-07-04 14:03:23	30491	1	NULL	NULL	NULL	1	1	1	BAJAJ ELECTRONICS KARMANGHAT HYDERABAD	PLOT NO 40,41, 42 43,SAGAR ROAD KARMANGHAT HYDERABAD	17.34528	17.34528	17.345232	17.345232	2018-07-04	1	India(IN)_Andhra Pradesh_Hyderabad, Hyderabad, Hyderabad, Andhra Pradesh, India	India(IN)_Andhra Pradesh_Hyderabad, Hyderabad, Hyderabad, Andhra Pradesh, India
356	935	2018-07-04 11:35:32	2018-07-04 19:36:01	24806	1	NULL	NULL	NULL	1	6	1	POWER VISION INDORE	D 3 AKASH GANGA SCHM NO 59 AMITESH NAGAR NEAR NEW SABJI MANDI INDORE    INDORE	22.702986	22.702986	0	0	2018-07-04	1	294, Annapurna Rd, Nai Duniya, Usha Nagar, Nidhi Vihar Colony, Indore, Madhya Pradesh 452009, India	NA
357	806	2018-07-04 11:35:34	2018-07-04 11:35:35	11529	1	NULL	NULL	NULL	1	4	1	VISHWAKARMA ELECTRONICS	5, DHULIBA COMPLEXA, NEAR CHANDLODIA OVER BRIDGE, CHANDLODIA, AHMEDABAD - 382481	23.080235	23.080235	23.080235	23.080235	2018-07-04	1	Chandlodia Rd, KK Nagar, Gayatri Nagar, Chandlodiya, Ahmedabad, Gujarat 382481, India	Chandlodia Rd, KK Nagar, Gayatri Nagar, Chandlodiya, Ahmedabad, Gujarat 382481, India
358	137	2018-07-04 11:35:53	2018-07-04 19:36:01	34	1	NULL	NULL	NULL	1	6	1	Capital First Nashik	Capital First Ltd. 4th Floor, Office No. 401 & 402, Sahayadree Business Park INC, MICO Circle Point Trambak Road, Tidke Colony, Above Hyundai Showroom, Nashik, Maharashtra, India 422002	19.99256	19.99256	0	0	2018-07-04	1	13, Trambakeshwar Rd, Wild Orcade Society, Tidke Colony, Nashik, Maharashtra 422005, India	NA
359	3018	2018-07-04 11:35:54	2018-07-04 19:36:01	31543	1	NULL	NULL	NULL	1	6	1	BIG CMOBILES PVT LTD BRODIPET GUNTUR	D no 5-27-300  4/7 Line Opp Mahabhodi hotel Brodipet Guntur -522002	16.30217	16.30217	0	0	2018-07-04	1	Avanthi Complex, 4th Ln, Brodipet, Guntur, Andhra Pradesh 522002, India	NA
360	806	2018-07-04 11:35:55	2018-07-04 11:35:56	11529	1	NULL	NULL	NULL	1	4	1	VISHWAKARMA ELECTRONICS	5, DHULIBA COMPLEXA, NEAR CHANDLODIA OVER BRIDGE, CHANDLODIA, AHMEDABAD - 382481	23.080254	23.080254	23.080254	23.080254	2018-07-04	1	30, Ambica Anandmayi Society, Near A.D.C. Bank, Ghansyam Nagar Part 2, Gayatri Nagar, Chandlodiya, Ahmedabad, Gujarat 382481, India	30, Ambica Anandmayi Society, Near A.D.C. Bank, Ghansyam Nagar Part 2, Gayatri Nagar, Chandlodiya, Ahmedabad, Gujarat 382481, India
361	1698	2018-07-04 11:35:58	2018-07-04 13:42:21	106	1	NULL	NULL	NULL	1	1	2	Suvidha home Collection	13/71 Dakshinpuri New Delhi 110062	28.526365	28.526365	28.5265	28.5265	2018-07-04	1	116, Dakshinpuri Area Rd, Dakshin Ambedkar Nagar, Dakshin Puri Extension, Dakshinpuri, New Delhi, Delhi 110062, India	70, Dakshinpuri Area Rd, Dakshin Ambedkar Nagar, Dakshin Puri Extension, Dakshinpuri, New Delhi, Delhi 110062, India
362	555	2018-07-04 11:36:00	2018-07-04 11:36:26	42444	1	NULL	NULL	NULL	1	1	1	MADHURAM MOBILE	SHOP NO 7 HARIHAR PARK VASTRAL ROAD MAHADEVNAGAR NRMAHADEV NAGAR TEKRO 382405	23.004074	23.004074	23.004074	23.004074	2018-07-04	1	D140, Vastral Road, Ashravi Nagar, jadeshwar park, Mahadev Nagar Tekra, Ahmedabad, Gujarat 382418, India	D140, Vastral Road, Ashravi Nagar, jadeshwar park, Mahadev Nagar Tekra, Ahmedabad, Gujarat 382418, India
363	1283	2018-07-04 11:35:58	2018-07-04 13:57:28	107	1	NULL	NULL	NULL	1	2	2	KUMAR INFO SOLUTION	At-GOTHAPATANA,PO-MALIPADA,PIN-751003	20.290728	20.290728	20.290644	20.290644	2018-07-04	1	Gangapatna - Paikraypur Rd, Gothapatna, Odisha 752054, India	Gangapatna - Paikraypur Rd, Gothapatna, Odisha 752054, India
364	1702	2018-07-04 11:36:24	2018-07-04 19:37:01	29994	1	NULL	NULL	NULL	1	6	1	NEW SLEEK ENTERPRISES DELHI	13/70 DAKSHIN PURI EXTN ND 62 DELHI	28.526663	28.526663	0	0	2018-07-04	1	21, Dakshinpuri Rd, Dakshin Ambedkar Nagar, Madangir Village, Madangir, New Delhi, Delhi 110062, India	NA
365	23	2018-07-04 11:36:40	2018-07-04 19:37:01	31010	1	NULL	NULL	NULL	1	6	1	VIJAY SALES CHINCHWAD	CB/2/No.1C,B-02 Empire Estate, Old Mumbai-Pune Highway,Nr.Ranka Jwellars.Pune	18.633583	18.633583	0	0	2018-07-04	1	Service Rd, Empire Estate Phase-II, Pimpri Colony, Pimpri-Chinchwad, Maharashtra 411019, India	NA
366	1624	2018-07-04 11:36:48	2018-07-04 12:03:05	108	1	NULL	NULL	NULL	1	1	2	GUPTA TELECOM	c242 60 ft road Mahaveer  enclave  Part 3	28.605213	28.605213	28.605848	28.605848	2018-07-04	1	C-290, Gali Number 40, Mahavir Enclave Part 2, Mahavir Enclave Part 3, Mahavir Enclave, ?? ??????, Delhi 110059, India	D-96, Street Number 50, Block A3, Uttam Nagar, Bindapur, Delhi, 110045, India
367	130	2018-07-04 11:39:45	2018-07-04 19:40:02	34	1	NULL	NULL	NULL	1	6	1	Capital First Nashik	Capital First Ltd. 4th Floor, Office No. 401 & 402, Sahayadree Business Park INC, MICO Circle Point Trambak Road, Tidke Colony, Above Hyundai Showroom, Nashik, Maharashtra, India 422002	19.99364	19.99364	0	0	2018-07-04	1	MICO Circle, Patrakar Colony, Parijat Nagar, Nashik, Maharashtra 422002, India	NA
368	2634	2018-07-04 11:36:59	2018-07-04 19:37:01	109	1	NULL	NULL	NULL	1	6	2	Shiva Sales	BBM POWER HOUSE JAMALPUR LDH	30.899776	30.899776	0	0	2018-07-04	1	Street Number:5, Chandigarh Rd, Gobind Colony, Ahluwalia Colony, Jamalpur Colony, Ludhiana, Punjab 141015, India	NA
369	2587	2018-07-04 11:37:05	2018-07-04 11:37:06	36597	1	NULL	NULL	NULL	1	4	1	KHANUJA ENTERPRISES LUDHIANA	9119 JOSHI NAGAR HAIBOWAL KALAN LUDHIANA 141001	30.919992	30.919992	30.919992	30.919992	2018-07-04	1	109, New Deep Nagar, Civil Lines, Ludhiana, Punjab 141001, India	109, New Deep Nagar, Civil Lines, Ludhiana, Punjab 141001, India
370	788	2018-07-04 11:37:10	2018-07-04 19:38:01	33715	1	NULL	NULL	NULL	1	6	1	IR CROMA DEVARC MALL AHMEDABAD GUJARAT	CROMA, Dev Arc Mall, Junction of Sg Road and Satellite Road,  Next to Fun Republic, Ahmadabad, 380053, Gujarat. 	23.026508	23.026508	0	0	2018-07-04	1	304, Pandurang Shastri Athavale Marg, Ramdev Nagar, Ahmedabad, Gujarat 380015, India	NA
371	2587	2018-07-04 11:37:11	2018-07-04 11:37:13	23945	1	NULL	NULL	NULL	1	4	1	ROHIT ELECTRONICS WORLD	933/3-B, ST NO1, NEW DEEP NAGAR, CIVIL LINES LUDHIANA	30.919992	30.919992	30.919992	30.919992	2018-07-04	1	109, New Deep Nagar, Civil Lines, Ludhiana, Punjab 141001, India	109, New Deep Nagar, Civil Lines, Ludhiana, Punjab 141001, India
372	3003	2018-07-04 11:37:25	2018-07-04 11:40:07	25097	1	NULL	NULL	NULL	1	2	1	SONOVISION ARUNDAL PET VIJAYAWADA	# 28-8-7,annadhanam samjam road, opp fire station Vinoda Thearter Arundelpet Vijawayada	16.514877	16.514877	16.514751	16.514751	2018-07-04	1	Annadana Samajam St, Arundalpet, Governorpet, Vijayawada, Andhra Pradesh 520002, India	28-8-9, Durgaiah St, Arundalpet, Governorpet, Vijayawada, Andhra Pradesh 520002, India
373	1176	2018-07-04 11:37:42	2018-07-04 19:38:01	11494	1	NULL	NULL	NULL	1	6	1	KHOSLA ELECTRONICS PVT LTD(DALHOUSIE)	1 & B OLD COURT HOUSE CORNER	22.572718	22.572718	0	0	2018-07-04	1	13/14, Lal Bazar St, B B D Bagh(E), Kolkata, West Bengal 700001, India	NA
374	1005	2018-07-04 11:37:46	2018-07-04 11:38:32	110	1	NULL	NULL	NULL	1	1	2	GREAT EASTERN TRADING CO GARIA	433 Garia Main Road	22.463018	22.463018	22.463018	22.463018	2018-07-04	1	South High Apartment, Garia Main Road, Barhans, Garia, Kolkata, West Bengal 700084, India	South High Apartment, Garia Main Road, Barhans, Garia, Kolkata, West Bengal 700084, India
375	992	2018-07-04 11:37:52	2018-07-04 19:38:01	12709	1	NULL	NULL	NULL	1	6	1	PATRA ELECTRONICS SAHEED NAGAR BHUBANESHWAR	8(p)acharya vihar,bhubaneswar,751013	20.286646	20.286646	0	0	2018-07-04	1	689, BMC Bhawani Mall St, Saheed Nagar, Bhubaneswar, Odisha 751007, India	NA
376	1357	2018-07-04 11:38:09	2018-07-04 19:39:01	111	1	NULL	NULL	NULL	1	6	2	ADISHWAR HEBBAGODI	NO 63 HOSUR MAIN ROAD HEBBAGODI 560099	12.830195	12.830195	0	0	2018-07-04	1	24, NH 44, Veer Sandra, Hebbagodi, Bengaluru, Karnataka 560100, India	NA
377	3181	2018-07-04 11:38:19	2018-07-04 19:39:01	112	1	NULL	NULL	NULL	1	6	2	Shri Meenakshi Fan House Pvt Ltd	West masi Street	9.920237	9.920237	0	0	2018-07-04	1	290, W Masi Rd, Madurai Main, Madurai, Tamil Nadu 625001, India	NA
378	681	2018-07-04 11:38:20	2018-07-04 19:39:01	28314	1	NULL	NULL	NULL	1	6	1	RD SHEETAL BHATAR 6356	SHEETAL COMPLEX, NR OLD LB CINEMA,NR FIRE STATION, BHATAR ROAD SURAT	21.175554	21.175554	0	0	2018-07-04	1	21, Bhatar Rd, IOC Colony, Subhash Nagar, Athwa, Surat, Gujarat 395017, India	NA
379	1763	2018-07-04 11:38:21	2018-07-04 19:39:01	30725	1	NULL	NULL	NULL	1	6	1	AKASH ELECTRONICS SHALIMAR DELHI	B - 11 MAIN HAIDERPUR ROAD SHALIMAR VILLAGE DELHI	28.721851	28.721851	0	0	2018-07-04	1	8, Shalimar Main Rd, Shalimar Village, Shalimar Bagh, Delhi, 110088, India	NA
380	1860	2018-07-04 11:38:28	2018-07-04 19:39:01	113	1	NULL	NULL	NULL	1	6	2	Mohit Traders Faridabad	1079 sector 23 a faridabad haryana	28.400919	28.400919	0	0	2018-07-04	1	3692, Pocket A, Sanjay Gandhi Memorial Nagar, Sector 48, Faridabad, Haryana 121001, India	NA
381	866	2018-07-04 11:38:36	2018-07-04 16:13:17	43062	1	NULL	NULL	NULL	1	1	1	KUMAR SALES CORPORATION	KUMARS KUMAR HOUSE DURGA MILL COMPOUND HIMATNAGAR 383001	23.593922	23.593922	23.59392	23.59392	2018-07-04	1	Ashraf Nagar, Himmatnagar, Gujarat 383001, India, Ashraf Nagar	Ashraf Nagar, Himmatnagar, Gujarat 383001, India, Ashraf Nagar
382	2682	2018-07-04 11:38:37	2018-07-04 19:39:01	114	1	NULL	NULL	NULL	1	6	2	Bajaj electronics kompally	Dno 04-009/nr (old no 3-24)survey no 43 near suchitra circle kompally	17.509916	17.509916	0	0	2018-07-04	1	23, NH 44, Bashirabad, Jeedimetla, Hyderabad, Telangana 500010, India	NA
383	2032	2018-07-04 11:38:45	2018-07-04 11:39:11	26686	1	NULL	NULL	NULL	1	1	1	BEST ASSOCIATES UDAIPUR	TOWN HALL ROAD OPP. BANK OF BARODA     UDAIPUR	24.58391	24.58391	24.58391	24.58391	2018-07-04	1	Panchsheel Marg, Shakti Nagar, Udaipur, Rajasthan 313001, India	Panchsheel Marg, Shakti Nagar, Udaipur, Rajasthan 313001, India
384	3190	2018-07-04 11:33:52	2018-07-04 19:34:01	115	1	NULL	NULL	NULL	1	6	2	Poorvika Madurai 1	NETHAJI ROAD	9.91712	9.91712	0	0	2018-07-04	1	167, Netaji Rd, New Ellis Nagar, Madurai Main, Madurai, Tamil Nadu 625001, India	NA
385	3189	2018-07-04 11:39:03	2018-07-04 19:40:02	116	1	NULL	NULL	NULL	1	6	2	Sangeetha Mobiles Anna Nagar	Anna nagar	9.921795	9.921795	0	0	2018-07-04	1	Raja College of Engineering and Technology Trust Office, Administrative Office Hig 42, 80 Feet Rd, Anna Nagar, Sathamangalam, Madurai, Tamil Nadu 625020, India	NA
386	2971	2018-07-04 11:39:22	2018-07-04 19:40:02	31527	1	NULL	NULL	NULL	1	6	1	LOT MOBILES PVT LTD TRENDSET BENZ CIRCLE  VIJAYAWADA	Shop No 2, Trendset Benz Mall, Benz Circle, Vijayawada.	16.498507	16.498507	0	0	2018-07-04	1	Sai Nag Complex, 40-1-52/5, MG Road, Opposite ICICI Bank, Municipal Employees Colony, Sriram Nagar, Benz Circle, Vijayawada, Andhra Pradesh 520010, India	NA
387	2032	2018-07-04 11:39:31	2018-07-04 11:41:19	25040	1	NULL	NULL	NULL	1	1	1	VIDEOTRONICS UDAIPUR	5A TOWN HALL ROAD NR BANK OF RAJASTHAN UDAIPUR UDAIPUR	24.583885	24.583885	24.583885	24.583885	2018-07-04	1	Panchsheel Marg, Shakti Nagar, Udaipur, Rajasthan 313001, India	Panchsheel Marg, Shakti Nagar, Udaipur, Rajasthan 313001, India
388	847	2018-07-04 11:39:32	2018-07-04 19:40:02	117	1	NULL	NULL	NULL	1	6	2	CHANDAN ENTERPRISE	SECTOR 21 GANDHAINAGAR	23.232338	23.232338	0	0	2018-07-04	1	167, Sector 21, Gandhinagar, Gujarat 382021, India	NA
389	1654	2018-07-04 11:39:35	2018-07-04 13:25:33	11808	1	NULL	NULL	NULL	1	1	1	NAVPREET ELECTRONICS VISHNU GARDEN KHAYALA DELHI	A 670 KHYALA DELHI 	28.652687	28.652687	28.657368	28.657368	2018-07-04	1	WZ328, Keshopur Rd, Block WZ, Khayala, Vishnu Garden, Delhi, 110018, India	Block N 455, Shree Krishna Gyan Mandir Marg, Near PS, Raghubir Nagar, Delhi, 110027, India
